{
  "$schema": "https://json-schema.org/draft/2020-12/schema",
  "$id": "https://github.com/tjsasakifln/Governance/control-center/contracts/schemas/finance-snapshot.v1.schema.json",
  "title": "FinanceSnapshot v1",
  "description": "Read-only aggregated finance state. Provider/financial mutations (cobrança, checkout, refund, cancelamento, Asaas writes) are forbidden in this campaign and MUST NOT appear on this document.",
  "type": "object",
  "additionalProperties": false,
  "required": [
    "schema_version",
    "id",
    "scope",
    "generated_at",
    "provenance",
    "read_model_only",
    "provider_mutations",
    "receivables_open",
    "receivables_overdue"
  ],
  "properties": {
    "schema_version": { "const": "control-center.finance-snapshot.v1" },
    "id": {
      "$ref": "https://github.com/tjsasakifln/Governance/control-center/contracts/schemas/primitives.v1.schema.json#/$defs/resource_id"
    },
    "scope": {
      "oneOf": [
        { "const": "finance" },
        { "const": "company" },
        {
          "$ref": "https://github.com/tjsasakifln/Governance/control-center/contracts/schemas/primitives.v1.schema.json#/$defs/client_scope"
        }
      ]
    },
    "generated_at": {
      "$ref": "https://github.com/tjsasakifln/Governance/control-center/contracts/schemas/primitives.v1.schema.json#/$defs/utc_datetime"
    },
    "provenance": {
      "$ref": "https://github.com/tjsasakifln/Governance/control-center/contracts/schemas/primitives.v1.schema.json#/$defs/provenance"
    },
    "read_model_only": { "const": true },
    "provider_mutations": { "const": "forbidden" },
    "receivables_open": {
      "$ref": "https://github.com/tjsasakifln/Governance/control-center/contracts/schemas/primitives.v1.schema.json#/$defs/unsigned_money"
    },
    "receivables_overdue": {
      "$ref": "https://github.com/tjsasakifln/Governance/control-center/contracts/schemas/primitives.v1.schema.json#/$defs/unsigned_money"
    },
    "attention_item_ids": {
      "type": "array",
      "maxItems": 32,
      "uniqueItems": true,
      "items": {
        "$ref": "https://github.com/tjsasakifln/Governance/control-center/contracts/schemas/primitives.v1.schema.json#/$defs/resource_id"
      }
    }
  }
}
